{
  "record_type": "aop_registry_record",
  "object_id": "urn:aop:tool:file-search:v1",
  "object_version": "v1",
  "kind": "tool",
  "name": "file-search",
  "digest": {
    "algo": "sha256",
    "value": "aaaaaaaaaaaaaaaaaaaaaaaaaaaaaaaaaaaaaaaaaaaaaaaaaaaaaaaaaaaaaaaa"
  },
  "locations": [
    "https://registry.example.com/objects/urn:aop:tool:file-search:v1"
  ],
  "signature_ref": "https://registry.example.com/signatures/urn:aop:tool:file-search:v1.sig",
  "published_at": "2026-03-04T00:00:00Z",
  "metadata": {
    "publisher": "aop-lab",
    "tags": ["search", "filesystem"]
  }
}
